{
 "version": 1,
 "updated": "2026-09-05",
 "note_en": "Planned coverage for channels OUTSIDE production-matrix.yaml (which plans the official-api arm). Each cell = model x effort x arm. status hints are computed by the site against landed data; 'planned' entries with awaiting notes are seats we intend to fill.",
 "note_zh": "production-matrix.yaml 之外通道的计划覆盖(matrix 只管官方 api 臂)。每格 = 模型 × effort × 臂。落地状态由站点对照真实数据计算;awaiting 备注表示待补的席位。",
 "arms": [
  {
   "arm": "CC",
   "arm_group": "harness",
   "family": "claude",
   "harness_en": "Claude Code CLI, isolated stock environment (no settings/skills/MCP)",
   "harness_zh": "Claude Code CLI,隔离纯净环境(无 settings/skills/MCP)",
   "models": [
    {
     "model_id": "claude-fable-5-1",
     "efforts": [
      "low",
      "medium",
      "high",
      "xhigh",
      "max"
     ]
    },
    {
     "model_id": "claude-opus-5",
     "efforts": [
      "low",
      "medium",
      "high",
      "xhigh",
      "max"
     ]
    },
    {
     "model_id": "claude-fable-5",
     "efforts": [
      "low",
      "medium",
      "high",
      "xhigh",
      "max"
     ]
    },
    {
     "model_id": "claude-opus-4-8",
     "efforts": [
      "low",
      "medium",
      "high",
      "xhigh",
      "max"
     ]
    },
    {
     "model_id": "claude-sonnet-5",
     "efforts": [
      "low",
      "medium",
      "high",
      "xhigh",
      "max"
     ]
    },
    {
     "model_id": "claude-haiku-4-5",
     "efforts": [
      "low",
      "medium",
      "high",
      "xhigh",
      "max"
     ]
    }
   ]
  },
  {
   "arm": "codex-oauth",
   "arm_group": "harness",
   "family": "gpt",
   "harness_en": "codex CLI signed into ChatGPT (isolated CODEX_HOME); community-reproducible by any ChatGPT subscriber",
   "harness_zh": "codex CLI 直登 ChatGPT(隔离 CODEX_HOME);任何 ChatGPT 订阅者可复现",
   "models": [
    {
     "model_id": "gpt-5.6-sol",
     "efforts": [
      "minimal",
      "low",
      "medium",
      "high",
      "xhigh"
     ]
    },
    {
     "model_id": "gpt-5.6-terra",
     "efforts": [
      "minimal",
      "low",
      "medium",
      "high",
      "xhigh"
     ]
    },
    {
     "model_id": "gpt-5.6-luna",
     "efforts": [
      "minimal",
      "low",
      "medium",
      "high",
      "xhigh"
     ]
    },
    {
     "model_id": "gpt-5.5",
     "efforts": [
      "minimal",
      "low",
      "medium",
      "high",
      "xhigh"
     ]
    },
    {
     "model_id": "gpt-5.4",
     "efforts": [
      "minimal",
      "low",
      "medium",
      "high",
      "xhigh"
     ]
    },
    {
     "model_id": "gpt-5.4-mini",
     "efforts": [
      "minimal",
      "low",
      "medium",
      "high",
      "xhigh"
     ]
    }
   ]
  },
  {
   "arm": "codex",
   "arm_group": "harness",
   "family": "gpt",
   "harness_en": "codex CLI via sub2api CPA distribution (ChatGPT-plan-backed, OpenAI-sanctioned 2api; isolated CODEX_HOME)",
   "harness_zh": "codex CLI 走 sub2api CPA 分发(ChatGPT plan 计费,官方允许的 2api 方案;隔离 CODEX_HOME)",
   "models": [
    {
     "model_id": "gpt-6-astra",
     "efforts": [
      null
     ]
    }
   ]
  },
  {
   "arm": "codex-app",
   "arm_group": "harness",
   "family": "gpt",
   "harness_en": "ChatGPT app codex @ultra (app-only tier, manual protocol)",
   "harness_zh": "ChatGPT app codex @ultra(app 独占档,手动跑)",
   "models": [
    {
     "model_id": "gpt-5.6-terra",
     "efforts": [
      "ultra"
     ]
    },
    {
     "model_id": "gpt-5.6-sol",
     "efforts": [
      "ultra"
     ]
    }
   ]
  },
  {
   "arm": "kiro",
   "arm_group": "harness",
   "family": "multi",
   "harness_en": "kiro-cli (AWS Kiro) on a GitHub-login credit plan, isolated fake-HOME stock environment; effort configs are driven through the interactive TUI via pty because --no-interactive silently drops effort (CLI 2.13.0)",
   "harness_zh": "kiro-cli(AWS Kiro)GitHub 登录 credit 订阅,隔离 fake-HOME 纯净环境;--no-interactive 会静默丢弃 effort(CLI 2.13.0),带 effort 的席位经 pty 驱动 interactive TUI 跑",
   "models": [
    {
     "model_id": "claude-sonnet-5",
     "efforts": [
      "low",
      "medium",
      "high",
      "xhigh",
      "max"
     ]
    },
    {
     "model_id": "claude-opus-4-8",
     "efforts": [
      "low",
      "medium",
      "high",
      "xhigh",
      "max"
     ]
    },
    {
     "model_id": "claude-opus-4-7",
     "efforts": [
      "low",
      "medium",
      "high",
      "xhigh",
      "max"
     ]
    },
    {
     "model_id": "claude-opus-4-6",
     "efforts": [
      "low",
      "medium",
      "high",
      "max"
     ]
    },
    {
     "model_id": "claude-opus-4-5",
     "efforts": [
      null
     ]
    },
    {
     "model_id": "claude-sonnet-4-6",
     "efforts": [
      "low",
      "medium",
      "high",
      "max"
     ]
    },
    {
     "model_id": "claude-sonnet-4-5",
     "efforts": [
      null
     ]
    },
    {
     "model_id": "claude-sonnet-4",
     "efforts": [
      null
     ]
    },
    {
     "model_id": "claude-haiku-4-5",
     "efforts": [
      null
     ]
    },
    {
     "model_id": "gpt-5.6-sol",
     "efforts": [
      "low",
      "medium",
      "high",
      "xhigh",
      "max"
     ]
    },
    {
     "model_id": "gpt-5.6-terra",
     "efforts": [
      "low",
      "medium",
      "high",
      "xhigh",
      "max"
     ]
    },
    {
     "model_id": "gpt-5.6-luna",
     "efforts": [
      "low",
      "medium",
      "high",
      "xhigh",
      "max"
     ]
    },
    {
     "model_id": "deepseek-v3.2",
     "efforts": [
      null
     ]
    },
    {
     "model_id": "minimax-m2.5",
     "efforts": [
      null
     ]
    },
    {
     "model_id": "minimax-m2.1",
     "efforts": [
      null
     ]
    },
    {
     "model_id": "glm-5",
     "efforts": [
      null
     ]
    },
    {
     "model_id": "qwen3-coder-next",
     "efforts": [
      null
     ]
    }
   ]
  },
  {
   "arm": "grok-cli",
   "arm_group": "harness",
   "family": "grok",
   "harness_en": "grok CLI OAuth, isolated fake-HOME stock environment",
   "harness_zh": "grok CLI OAuth,隔离 fake-HOME 纯净环境",
   "models": [
    {
     "model_id": "grok-4.5",
     "efforts": [
      "low",
      "medium",
      "high"
     ]
    },
    {
     "model_id": "grok-4.6",
     "efforts": [
      "low",
      "medium",
      "high",
      "xhigh"
     ]
    }
   ]
  },
  {
   "arm": "qoder",
   "arm_group": "harness",
   "family": "qwen",
   "harness_en": "Qoder CLI (Alibaba, Claude-Code-compatible; iFlow's successor), stock login; --reasoning-effort silently ignored for qwen so no effort axis",
   "harness_zh": "Qoder CLI(阿里,Claude Code 兼容;iFlow 官方继任)登录态直用;--reasoning-effort 对 qwen 静默忽略,不展开 effort",
   "models": [
    {
     "model_id": "qwen3.8-max-preview",
     "efforts": [
      null
     ]
    },
    {
     "model_id": "qwen3.7-max",
     "efforts": [
      null
     ]
    }
   ]
  },
  {
   "arm": "cursor",
   "arm_group": "harness",
   "family": "multi",
   "harness_en": "cursor-agent CLI, Cursor plan, isolated fake-HOME stock environment",
   "harness_zh": "cursor-agent CLI,Cursor 订阅,隔离 fake-HOME 纯净环境",
   "models": [
    {
     "model_id": "claude-fable-5",
     "efforts": [
      "low",
      "medium",
      "high",
      "xhigh",
      "max"
     ]
    },
    {
     "model_id": "claude-fable-5-thinking",
     "efforts": [
      "low",
      "medium",
      "high",
      "xhigh",
      "max"
     ]
    },
    {
     "model_id": "claude-opus-4-5",
     "efforts": [
      "high"
     ]
    },
    {
     "model_id": "claude-opus-4-5-thinking",
     "efforts": [
      "high"
     ]
    },
    {
     "model_id": "claude-opus-4-6",
     "efforts": [
      "high",
      "max"
     ]
    },
    {
     "model_id": "claude-opus-4-6-thinking",
     "efforts": [
      "high",
      "max"
     ]
    },
    {
     "model_id": "claude-opus-4-7",
     "efforts": [
      "low",
      "medium",
      "high",
      "xhigh",
      "max"
     ]
    },
    {
     "model_id": "claude-opus-4-7-thinking",
     "efforts": [
      "low",
      "medium",
      "high",
      "xhigh",
      "max"
     ]
    },
    {
     "model_id": "claude-opus-4-8",
     "efforts": [
      "low",
      "medium",
      "high",
      "xhigh",
      "max"
     ]
    },
    {
     "model_id": "claude-opus-4-8-thinking",
     "efforts": [
      "low",
      "medium",
      "high",
      "xhigh",
      "max"
     ]
    },
    {
     "model_id": "claude-opus-5",
     "efforts": [
      "low",
      "medium",
      "high"
     ]
    },
    {
     "model_id": "claude-opus-5-thinking",
     "efforts": [
      "low",
      "medium",
      "high",
      "xhigh",
      "max"
     ]
    },
    {
     "model_id": "claude-sonnet-4",
     "efforts": []
    },
    {
     "model_id": "claude-sonnet-4-5",
     "efforts": []
    },
    {
     "model_id": "claude-sonnet-4-5-thinking",
     "efforts": []
    },
    {
     "model_id": "claude-sonnet-4-6",
     "efforts": [
      "medium"
     ]
    },
    {
     "model_id": "claude-sonnet-4-6-thinking",
     "efforts": [
      "medium"
     ]
    },
    {
     "model_id": "claude-sonnet-4-thinking",
     "efforts": []
    },
    {
     "model_id": "claude-sonnet-5",
     "efforts": [
      "low",
      "medium",
      "high",
      "xhigh",
      "max"
     ]
    },
    {
     "model_id": "claude-sonnet-5-thinking",
     "efforts": [
      "low",
      "medium",
      "high",
      "xhigh",
      "max"
     ]
    },
    {
     "model_id": "composer-2.5",
     "efforts": []
    },
    {
     "model_id": "cursor-grok-4.5",
     "efforts": [
      "low",
      "medium",
      "high"
     ]
    },
    {
     "model_id": "cursor-grok-4.6",
     "efforts": [
      "low",
      "medium",
      "high",
      "xhigh"
     ]
    },
    {
     "model_id": "gemini-3-flash",
     "efforts": []
    },
    {
     "model_id": "gemini-3.1-pro",
     "efforts": []
    },
    {
     "model_id": "gemini-3.5-flash",
     "efforts": []
    },
    {
     "model_id": "gemini-3.6-flash",
     "efforts": [